{"locale":"de","messages":{"cli.sync.done":{"type":"message","declarations":[],"pattern":[{"type":"expression","arg":{"type":"variable","name":"count"},"function":{"type":"function","name":"integer"}}," Einträge in ",{"type":"expression","arg":{"type":"variable","name":"seconds"},"function":{"type":"function","name":"number","options":{"maximumFractionDigits":{"type":"literal","value":"1"}}}}," s synchronisiert"]},"email.welcome.body":{"type":"select","declarations":[{"type":"input","name":"loaves","value":{"type":"expression","arg":{"type":"variable","name":"loaves"},"function":{"type":"function","name":"integer"}}}],"selectors":[{"type":"variable","name":"loaves"}],"variants":[{"keys":[{"type":"literal","value":"one"}],"value":["Dein erstes Brot ist unterwegs."]},{"keys":[{"type":"*"}],"value":["Deine ",{"type":"expression","arg":{"type":"variable","name":"loaves"}}," Brote sind unterwegs."]}]},"email.welcome.subject":{"type":"message","declarations":[],"pattern":["Willkommen bei Brotwerk, ",{"type":"expression","arg":{"type":"variable","name":"name"}},"!"]},"greeting":{"type":"message","declarations":[],"pattern":["Hallo!"]}},"namespace":"default","schema":"glossa.artifact/v1"}