{"locale":"es","messages":{"export.col.completion":{"type":"message","declarations":[],"pattern":["Cumplimiento"]},"export.col.date":{"type":"message","declarations":[],"pattern":["Fecha"]},"export.col.distance":{"type":"message","declarations":[],"pattern":["Distancia"]},"export.col.load":{"type":"message","declarations":[],"pattern":["Carga total"]},"export.col.reps":{"type":"message","declarations":[],"pattern":["Repeticiones"]},"export.col.sessions":{"type":"message","declarations":[],"pattern":["Sesiones"]},"export.doctitle":{"type":"message","declarations":[],"pattern":["Exportación de entrenamientos – ",{"type":"expression","arg":{"type":"variable","name":"athlete"}}]},"export.footer":{"type":"message","declarations":[],"pattern":[{"type":"markup","kind":"open","name":"i"},"Exportado el ",{"type":"expression","arg":{"type":"variable","name":"at"},"function":{"type":"function","name":"datetime","options":{"dateLength":{"type":"literal","value":"medium"},"timePrecision":{"type":"literal","value":"minute"}}}},{"type":"markup","kind":"close","name":"i"}]},"export.note":{"type":"message","declarations":[],"pattern":[{"type":"markup","kind":"open","name":"b"},"Nota:",{"type":"markup","kind":"close","name":"b"}," las distancias son ",{"type":"markup","kind":"open","name":"i"},"estimaciones GPS",{"type":"markup","kind":"close","name":"i"},"; la carga total se calcula ",{"type":"markup","kind":"open","name":"u"},"sin",{"type":"markup","kind":"close","name":"u"}," el peso corporal."]},"export.sessions":{"type":"select","declarations":[{"type":"input","name":"count","value":{"type":"expression","arg":{"type":"variable","name":"count"},"function":{"type":"function","name":"integer"}}}],"selectors":[{"type":"variable","name":"count"}],"variants":[{"keys":[{"type":"literal","value":"one"}],"value":[{"type":"expression","arg":{"type":"variable","name":"count"}}," sesión"]},{"keys":[{"type":"*"}],"value":[{"type":"expression","arg":{"type":"variable","name":"count"}}," sesiones"]}]},"export.summary":{"type":"select","declarations":[{"type":"input","name":"count","value":{"type":"expression","arg":{"type":"variable","name":"count"},"function":{"type":"function","name":"integer"}}}],"selectors":[{"type":"variable","name":"count"}],"variants":[{"keys":[{"type":"literal","value":"one"}],"value":[{"type":"markup","kind":"open","name":"b"},{"type":"expression","arg":{"type":"variable","name":"count"}}," sesión",{"type":"markup","kind":"close","name":"b"}," del ",{"type":"expression","arg":{"type":"variable","name":"from"},"function":{"type":"function","name":"date"}}," al ",{"type":"expression","arg":{"type":"variable","name":"to"},"function":{"type":"function","name":"date"}}]},{"keys":[{"type":"*"}],"value":[{"type":"markup","kind":"open","name":"b"},{"type":"expression","arg":{"type":"variable","name":"count"}}," sesiones",{"type":"markup","kind":"close","name":"b"}," del ",{"type":"expression","arg":{"type":"variable","name":"from"},"function":{"type":"function","name":"date"}}," al ",{"type":"expression","arg":{"type":"variable","name":"to"},"function":{"type":"function","name":"date"}}]}]},"export.title":{"type":"message","declarations":[],"pattern":[{"type":"markup","kind":"open","name":"b"},"Exportación de entrenamientos",{"type":"markup","kind":"close","name":"b"}," – ",{"type":"expression","arg":{"type":"variable","name":"athlete"}}]},"tax.col.eur":{"type":"message","declarations":[],"pattern":["Importe (EUR)"]},"tax.col.item":{"type":"message","declarations":[],"pattern":["Concepto"]},"tax.col.jpy":{"type":"message","declarations":[],"pattern":["Importe (JPY)"]},"tax.col.receipts":{"type":"message","declarations":[],"pattern":["Justificantes"]},"tax.doctitle":{"type":"message","declarations":[],"pattern":["Resumen fiscal ",{"type":"expression","arg":{"type":"variable","name":"year"}}]},"tax.due":{"type":"message","declarations":[],"pattern":["Fecha límite de pago: ",{"type":"markup","kind":"open","name":"b"},{"type":"expression","arg":{"type":"variable","name":"due"},"function":{"type":"function","name":"date","options":{"length":{"type":"literal","value":"long"}}}},{"type":"markup","kind":"close","name":"b"}]},"tax.intro":{"type":"message","declarations":[],"pattern":["Este resumen recoge la ",{"type":"markup","kind":"open","name":"b"},"declaración de la renta",{"type":"markup","kind":"close","name":"b"}," de ",{"type":"expression","arg":{"type":"variable","name":"taxpayer"}},". ",{"type":"markup","kind":"open","name":"i"},"Todos los importes son provisionales.",{"type":"markup","kind":"close","name":"i"}]},"tax.issued":{"type":"message","declarations":[],"pattern":["Emitido el ",{"type":"expression","arg":{"type":"variable","name":"issued"},"function":{"type":"function","name":"datetime","options":{"dateLength":{"type":"literal","value":"long"},"timePrecision":{"type":"literal","value":"minute"},"timeZone":{"type":"literal","value":"Asia/Tokyo"}}}}," (hora de Tokio)"]},"tax.item.donations":{"type":"message","declarations":[],"pattern":["Donativos y cuotas de afiliación"]},"tax.item.insurance":{"type":"message","declarations":[],"pattern":["Primas del seguro de responsabilidad civil de vehículos"]},"tax.item.prepayments":{"type":"message","declarations":[],"pattern":["Pagos a cuenta del IRPF"]},"tax.item.salary":{"type":"message","declarations":[],"pattern":["Rendimientos del trabajo"]},"tax.period":{"type":"message","declarations":[],"pattern":["Período impositivo: del ",{"type":"expression","arg":{"type":"variable","name":"from"},"function":{"type":"function","name":"date","options":{"length":{"type":"literal","value":"long"}}}}," al ",{"type":"expression","arg":{"type":"variable","name":"to"},"function":{"type":"function","name":"date","options":{"length":{"type":"literal","value":"long"}}}}]},"tax.receipts":{"type":"select","declarations":[{"type":"input","name":"count","value":{"type":"expression","arg":{"type":"variable","name":"count"},"function":{"type":"function","name":"integer"}}}],"selectors":[{"type":"variable","name":"count"}],"variants":[{"keys":[{"type":"literal","value":"one"}],"value":[{"type":"expression","arg":{"type":"variable","name":"count"}}," justificante"]},{"keys":[{"type":"*"}],"value":[{"type":"expression","arg":{"type":"variable","name":"count"}}," justificantes"]}]},"tax.status":{"type":"select","declarations":[{"type":"input","name":"status","value":{"type":"expression","arg":{"type":"variable","name":"status"},"function":{"type":"function","name":"string"}}}],"selectors":[{"type":"variable","name":"status"}],"variants":[{"keys":[{"type":"literal","value":"single"}],"value":["Modalidad de declaración: ",{"type":"markup","kind":"open","name":"b"},"individual",{"type":"markup","kind":"close","name":"b"}]},{"keys":[{"type":"literal","value":"joint"}],"value":["Modalidad de declaración: ",{"type":"markup","kind":"open","name":"b"},"conjunta",{"type":"markup","kind":"close","name":"b"}]},{"keys":[{"type":"*"}],"value":["Modalidad de declaración: ",{"type":"markup","kind":"open","name":"b"},"otra",{"type":"markup","kind":"close","name":"b"}]}]},"tax.title":{"type":"message","declarations":[],"pattern":[{"type":"markup","kind":"open","name":"b"},"Resumen fiscal",{"type":"markup","kind":"close","name":"b"}," ",{"type":"expression","arg":{"type":"variable","name":"year"}}]},"tax.total":{"type":"message","declarations":[],"pattern":[{"type":"markup","kind":"open","name":"b"},"Total",{"type":"markup","kind":"close","name":"b"}]}},"namespace":"default","schema":"glossa.artifact/v1"}