{"locale":"en","messages":{"cli.sync.done":{"type":"message","declarations":[],"pattern":["Synced ",{"type":"expression","arg":{"type":"variable","name":"count"},"function":{"type":"function","name":"integer"}}," items in ",{"type":"expression","arg":{"type":"variable","name":"seconds"},"function":{"type":"function","name":"number","options":{"maximumFractionDigits":{"type":"literal","value":"1"}}}},"s"]},"email.welcome.body":{"type":"select","declarations":[{"type":"input","name":"loaves","value":{"type":"expression","arg":{"type":"variable","name":"loaves"},"function":{"type":"function","name":"integer"}}}],"selectors":[{"type":"variable","name":"loaves"}],"variants":[{"keys":[{"type":"literal","value":"one"}],"value":["Your first loaf is on its way."]},{"keys":[{"type":"*"}],"value":["Your ",{"type":"expression","arg":{"type":"variable","name":"loaves"}}," loaves are on their way."]}]},"email.welcome.subject":{"type":"message","declarations":[],"pattern":["Welcome to Brotwerk, ",{"type":"expression","arg":{"type":"variable","name":"name"}},"!"]},"greeting":{"type":"message","declarations":[],"pattern":["Hello!"]},"invoice.overdue":{"type":"message","declarations":[],"pattern":["Invoice ",{"type":"expression","arg":{"type":"variable","name":"number"}}," is overdue."]},"invoice.terms":{"type":"message","declarations":[],"pattern":["Pay within ",{"type":"markup","kind":"open","name":"b"},{"type":"expression","arg":{"type":"variable","name":"days"},"function":{"type":"function","name":"integer"}}," days",{"type":"markup","kind":"close","name":"b"},".",{"type":"markup","kind":"standalone","name":"br"},{"type":"markup","kind":"open","name":"link","options":{"href":{"type":"literal","value":"https://example.com/help"}}},{"type":"markup","kind":"open","name":"i"},"Questions?",{"type":"markup","kind":"close","name":"i"}," Ask ",{"type":"markup","kind":"open","name":"u"},"us",{"type":"markup","kind":"close","name":"u"},".",{"type":"markup","kind":"close","name":"link"}]}},"namespace":"default","schema":"glossa.artifact/v1"}