{"locale":"ja","messages":{"export.col.completion":{"type":"message","declarations":[],"pattern":["達成率"]},"export.col.date":{"type":"message","declarations":[],"pattern":["日付"]},"export.col.distance":{"type":"message","declarations":[],"pattern":["距離"]},"export.col.load":{"type":"message","declarations":[],"pattern":["総負荷"]},"export.col.reps":{"type":"message","declarations":[],"pattern":["レップ数"]},"export.col.sessions":{"type":"message","declarations":[],"pattern":["セッション"]},"export.doctitle":{"type":"message","declarations":[],"pattern":["トレーニングのエクスポート – ",{"type":"expression","arg":{"type":"variable","name":"athlete"}}]},"export.footer":{"type":"message","declarations":[],"pattern":[{"type":"markup","kind":"open","name":"i"},"エクスポート日時：",{"type":"expression","arg":{"type":"variable","name":"at"},"function":{"type":"function","name":"datetime","options":{"dateLength":{"type":"literal","value":"medium"},"timePrecision":{"type":"literal","value":"minute"}}}},{"type":"markup","kind":"close","name":"i"}]},"export.note":{"type":"message","declarations":[],"pattern":[{"type":"markup","kind":"open","name":"b"},"注：",{"type":"markup","kind":"close","name":"b"},"距離は",{"type":"markup","kind":"open","name":"i"},"GPSによる推定値",{"type":"markup","kind":"close","name":"i"},"です。総負荷は体重を",{"type":"markup","kind":"open","name":"u"},"含まずに",{"type":"markup","kind":"close","name":"u"},"計算しています。"]},"export.sessions":{"type":"message","declarations":[],"pattern":[{"type":"expression","arg":{"type":"variable","name":"count"},"function":{"type":"function","name":"integer"}},"回"]},"export.summary":{"type":"message","declarations":[],"pattern":[{"type":"markup","kind":"open","name":"b"},{"type":"expression","arg":{"type":"variable","name":"count"},"function":{"type":"function","name":"integer"}},"回のセッション",{"type":"markup","kind":"close","name":"b"},"（",{"type":"expression","arg":{"type":"variable","name":"from"},"function":{"type":"function","name":"date"}},"～",{"type":"expression","arg":{"type":"variable","name":"to"},"function":{"type":"function","name":"date"}},"）"]},"export.title":{"type":"message","declarations":[],"pattern":[{"type":"markup","kind":"open","name":"b"},"トレーニングのエクスポート",{"type":"markup","kind":"close","name":"b"}," – ",{"type":"expression","arg":{"type":"variable","name":"athlete"}}]},"tax.col.eur":{"type":"message","declarations":[],"pattern":["金額（EUR）"]},"tax.col.item":{"type":"message","declarations":[],"pattern":["項目"]},"tax.col.jpy":{"type":"message","declarations":[],"pattern":["金額（JPY）"]},"tax.col.receipts":{"type":"message","declarations":[],"pattern":["領収書"]},"tax.doctitle":{"type":"message","declarations":[],"pattern":["税務サマリー ",{"type":"expression","arg":{"type":"variable","name":"year"}},"年"]},"tax.due":{"type":"message","declarations":[],"pattern":["お支払い期限：",{"type":"markup","kind":"open","name":"b"},{"type":"expression","arg":{"type":"variable","name":"due"},"function":{"type":"function","name":"date","options":{"length":{"type":"literal","value":"long"}}}},{"type":"markup","kind":"close","name":"b"}]},"tax.intro":{"type":"message","declarations":[],"pattern":[{"type":"expression","arg":{"type":"variable","name":"taxpayer"}},"様の",{"type":"markup","kind":"open","name":"b"},"所得税確定申告",{"type":"markup","kind":"close","name":"b"},"の概要です。",{"type":"markup","kind":"open","name":"i"},"金額はすべて暫定値です。",{"type":"markup","kind":"close","name":"i"}]},"tax.issued":{"type":"message","declarations":[],"pattern":["発行日時：",{"type":"expression","arg":{"type":"variable","name":"issued"},"function":{"type":"function","name":"datetime","options":{"dateLength":{"type":"literal","value":"long"},"timePrecision":{"type":"literal","value":"minute"},"timeZone":{"type":"literal","value":"Asia/Tokyo"}}}},"（東京時間）"]},"tax.item.donations":{"type":"message","declarations":[],"pattern":["寄附金および会費"]},"tax.item.insurance":{"type":"message","declarations":[],"pattern":["自動車損害賠償責任保険料"]},"tax.item.prepayments":{"type":"message","declarations":[],"pattern":["所得税の予定納税"]},"tax.item.salary":{"type":"message","declarations":[],"pattern":["給与所得"]},"tax.period":{"type":"message","declarations":[],"pattern":["課税期間：",{"type":"expression","arg":{"type":"variable","name":"from"},"function":{"type":"function","name":"date","options":{"length":{"type":"literal","value":"long"}}}},"～",{"type":"expression","arg":{"type":"variable","name":"to"},"function":{"type":"function","name":"date","options":{"length":{"type":"literal","value":"long"}}}}]},"tax.receipts":{"type":"message","declarations":[],"pattern":[{"type":"expression","arg":{"type":"variable","name":"count"},"function":{"type":"function","name":"integer"}},"件"]},"tax.status":{"type":"select","declarations":[{"type":"input","name":"status","value":{"type":"expression","arg":{"type":"variable","name":"status"},"function":{"type":"function","name":"string"}}}],"selectors":[{"type":"variable","name":"status"}],"variants":[{"keys":[{"type":"literal","value":"single"}],"value":["申告区分：",{"type":"markup","kind":"open","name":"b"},"個別申告",{"type":"markup","kind":"close","name":"b"}]},{"keys":[{"type":"literal","value":"joint"}],"value":["申告区分：",{"type":"markup","kind":"open","name":"b"},"合算申告",{"type":"markup","kind":"close","name":"b"}]},{"keys":[{"type":"*"}],"value":["申告区分：",{"type":"markup","kind":"open","name":"b"},"その他",{"type":"markup","kind":"close","name":"b"}]}]},"tax.title":{"type":"message","declarations":[],"pattern":[{"type":"markup","kind":"open","name":"b"},"税務サマリー",{"type":"markup","kind":"close","name":"b"}," ",{"type":"expression","arg":{"type":"variable","name":"year"}},"年"]},"tax.total":{"type":"message","declarations":[],"pattern":[{"type":"markup","kind":"open","name":"b"},"合計",{"type":"markup","kind":"close","name":"b"}]}},"namespace":"default","schema":"glossa.artifact/v1"}