{"locale":"fr","messages":{"export.col.completion":{"type":"message","declarations":[],"pattern":["Réalisation"]},"export.col.date":{"type":"message","declarations":[],"pattern":["Date"]},"export.col.distance":{"type":"message","declarations":[],"pattern":["Distance"]},"export.col.load":{"type":"message","declarations":[],"pattern":["Charge totale"]},"export.col.reps":{"type":"message","declarations":[],"pattern":["Répétitions"]},"export.col.sessions":{"type":"message","declarations":[],"pattern":["Séances"]},"export.doctitle":{"type":"message","declarations":[],"pattern":["Export des entraînements – ",{"type":"expression","arg":{"type":"variable","name":"athlete"}}]},"export.footer":{"type":"message","declarations":[],"pattern":[{"type":"markup","kind":"open","name":"i"},"Exporté le ",{"type":"expression","arg":{"type":"variable","name":"at"},"function":{"type":"function","name":"datetime","options":{"dateLength":{"type":"literal","value":"medium"},"timePrecision":{"type":"literal","value":"minute"}}}},{"type":"markup","kind":"close","name":"i"}]},"export.note":{"type":"message","declarations":[],"pattern":[{"type":"markup","kind":"open","name":"b"},"Remarque :",{"type":"markup","kind":"close","name":"b"}," les distances sont des ",{"type":"markup","kind":"open","name":"i"},"estimations GPS",{"type":"markup","kind":"close","name":"i"}," ; la charge totale est calculée ",{"type":"markup","kind":"open","name":"u"},"sans",{"type":"markup","kind":"close","name":"u"}," le poids du corps."]},"export.sessions":{"type":"select","declarations":[{"type":"input","name":"count","value":{"type":"expression","arg":{"type":"variable","name":"count"},"function":{"type":"function","name":"integer"}}}],"selectors":[{"type":"variable","name":"count"}],"variants":[{"keys":[{"type":"literal","value":"one"}],"value":[{"type":"expression","arg":{"type":"variable","name":"count"}}," séance"]},{"keys":[{"type":"*"}],"value":[{"type":"expression","arg":{"type":"variable","name":"count"}}," séances"]}]},"export.summary":{"type":"select","declarations":[{"type":"input","name":"count","value":{"type":"expression","arg":{"type":"variable","name":"count"},"function":{"type":"function","name":"integer"}}}],"selectors":[{"type":"variable","name":"count"}],"variants":[{"keys":[{"type":"literal","value":"one"}],"value":[{"type":"markup","kind":"open","name":"b"},{"type":"expression","arg":{"type":"variable","name":"count"}}," séance",{"type":"markup","kind":"close","name":"b"}," du ",{"type":"expression","arg":{"type":"variable","name":"from"},"function":{"type":"function","name":"date"}}," au ",{"type":"expression","arg":{"type":"variable","name":"to"},"function":{"type":"function","name":"date"}}]},{"keys":[{"type":"*"}],"value":[{"type":"markup","kind":"open","name":"b"},{"type":"expression","arg":{"type":"variable","name":"count"}}," séances",{"type":"markup","kind":"close","name":"b"}," du ",{"type":"expression","arg":{"type":"variable","name":"from"},"function":{"type":"function","name":"date"}}," au ",{"type":"expression","arg":{"type":"variable","name":"to"},"function":{"type":"function","name":"date"}}]}]},"export.title":{"type":"message","declarations":[],"pattern":[{"type":"markup","kind":"open","name":"b"},"Export des entraînements",{"type":"markup","kind":"close","name":"b"}," – ",{"type":"expression","arg":{"type":"variable","name":"athlete"}}]},"tax.col.eur":{"type":"message","declarations":[],"pattern":["Montant (EUR)"]},"tax.col.item":{"type":"message","declarations":[],"pattern":["Poste"]},"tax.col.jpy":{"type":"message","declarations":[],"pattern":["Montant (JPY)"]},"tax.col.receipts":{"type":"message","declarations":[],"pattern":["Justificatifs"]},"tax.doctitle":{"type":"message","declarations":[],"pattern":["Récapitulatif fiscal ",{"type":"expression","arg":{"type":"variable","name":"year"}}]},"tax.due":{"type":"message","declarations":[],"pattern":["À payer au plus tard le ",{"type":"markup","kind":"open","name":"b"},{"type":"expression","arg":{"type":"variable","name":"due"},"function":{"type":"function","name":"date","options":{"length":{"type":"literal","value":"long"}}}},{"type":"markup","kind":"close","name":"b"}]},"tax.intro":{"type":"message","declarations":[],"pattern":["Ce récapitulatif porte sur la ",{"type":"markup","kind":"open","name":"b"},"déclaration de revenus",{"type":"markup","kind":"close","name":"b"}," de ",{"type":"expression","arg":{"type":"variable","name":"taxpayer"}},". ",{"type":"markup","kind":"open","name":"i"},"Tous les montants sont provisoires.",{"type":"markup","kind":"close","name":"i"}]},"tax.issued":{"type":"message","declarations":[],"pattern":["Émis le ",{"type":"expression","arg":{"type":"variable","name":"issued"},"function":{"type":"function","name":"datetime","options":{"dateLength":{"type":"literal","value":"long"},"timePrecision":{"type":"literal","value":"minute"},"timeZone":{"type":"literal","value":"Asia/Tokyo"}}}}," (heure de Tokyo)"]},"tax.item.donations":{"type":"message","declarations":[],"pattern":["Dons et cotisations"]},"tax.item.insurance":{"type":"message","declarations":[],"pattern":["Primes d’assurance responsabilité civile automobile"]},"tax.item.prepayments":{"type":"message","declarations":[],"pattern":["Acomptes d’impôt sur le revenu"]},"tax.item.salary":{"type":"message","declarations":[],"pattern":["Traitements et salaires"]},"tax.period":{"type":"message","declarations":[],"pattern":["Période d’imposition : du ",{"type":"expression","arg":{"type":"variable","name":"from"},"function":{"type":"function","name":"date","options":{"length":{"type":"literal","value":"long"}}}}," au ",{"type":"expression","arg":{"type":"variable","name":"to"},"function":{"type":"function","name":"date","options":{"length":{"type":"literal","value":"long"}}}}]},"tax.receipts":{"type":"select","declarations":[{"type":"input","name":"count","value":{"type":"expression","arg":{"type":"variable","name":"count"},"function":{"type":"function","name":"integer"}}}],"selectors":[{"type":"variable","name":"count"}],"variants":[{"keys":[{"type":"literal","value":"one"}],"value":[{"type":"expression","arg":{"type":"variable","name":"count"}}," justificatif"]},{"keys":[{"type":"*"}],"value":[{"type":"expression","arg":{"type":"variable","name":"count"}}," justificatifs"]}]},"tax.status":{"type":"select","declarations":[{"type":"input","name":"status","value":{"type":"expression","arg":{"type":"variable","name":"status"},"function":{"type":"function","name":"string"}}}],"selectors":[{"type":"variable","name":"status"}],"variants":[{"keys":[{"type":"literal","value":"single"}],"value":["Situation déclarative : ",{"type":"markup","kind":"open","name":"b"},"imposition individuelle",{"type":"markup","kind":"close","name":"b"}]},{"keys":[{"type":"literal","value":"joint"}],"value":["Situation déclarative : ",{"type":"markup","kind":"open","name":"b"},"imposition commune",{"type":"markup","kind":"close","name":"b"}]},{"keys":[{"type":"*"}],"value":["Situation déclarative : ",{"type":"markup","kind":"open","name":"b"},"autre",{"type":"markup","kind":"close","name":"b"}]}]},"tax.title":{"type":"message","declarations":[],"pattern":[{"type":"markup","kind":"open","name":"b"},"Récapitulatif fiscal",{"type":"markup","kind":"close","name":"b"}," ",{"type":"expression","arg":{"type":"variable","name":"year"}}]},"tax.total":{"type":"message","declarations":[],"pattern":[{"type":"markup","kind":"open","name":"b"},"Total",{"type":"markup","kind":"close","name":"b"}]}},"namespace":"default","schema":"glossa.artifact/v1"}